<?xml version="1.0" encoding="UTF-8"?>
<se:Sertifikat
	xmlns:xs="http://www.w3.org/2001/XMLSchema"
	xmlns:se="http:///www.ftn.uns.ac.rs/vakcinacija/sertifikat" xmlns:xsi="http://www.w3.org/2001/XMLSchema-instance"
    xmlns:ct="http:///www.ftn.uns.ac.rs/vakcinacija/commonTypes"
    xsi:schemaLocation="http:///www.ftn.uns.ac.rs/vakcinacija/sertifikat  ../xsd/sertifikat.xsd"
    xmlns:addr="http://www.ftn.uns.ac.rs/rdf/sertifikat"
    xmlns:pred="http://www.ftn.uns.ac.rs/rdf/sertifikat/predicate/"
    vocab="http://www.ftn.uns.ac.rs/rdf/sertifikat/"
    about="http://www.ftn.uns.ac.rs/rdf/sertifikat/3553355353532">
    <se:BrojSertifikata>SERT-3848837820</se:BrojSertifikata>
    <se:DatumVremeIzdavanja>2021-11-02T21:32:52</se:DatumVremeIzdavanja>
    <se:QR>http://www.ftn.uns.ac.rs/</se:QR>
    <se:LicneInformacije>
        <se:PunoIme>
            <ct:Ime>Petar</ct:Ime>
            <ct:Prezime>Markovic</ct:Prezime>
        </se:PunoIme>
        <se:DatumRodjenja>1990-08-01</se:DatumRodjenja>
        <se:Pol>Muski</se:Pol>
        <se:JMBG property = "pred:jmbg" datatype = "xs:string">3553355353532</se:JMBG>
        <se:BrojPasosa property = "pred:brojPasosa" datatype = "xs:string">040503921</se:BrojPasosa>
    </se:LicneInformacije>
    <se:Vakcinacija>
        <se:BrojDoze>1</se:BrojDoze>
        <se:TipVakcine property = "pred:tipVakcine" datatype = "xs:string">Pfizer-BioNTech</se:TipVakcine>
        <se:DatumDavanja>2021-06-02</se:DatumDavanja>
        <se:Proizvodjac>BIONTECH MANUFACTURING GMBH</se:Proizvodjac>
        <se:Serija>PFI-55609</se:Serija>
        <se:ZdravstvenaUstanova>DOM ZDRAVLJA NOVI SAD</se:ZdravstvenaUstanova>
    </se:Vakcinacija>
    <se:Test>
        <se:ImeTesta>SARS-CoV-2 RT</se:ImeTesta>
        <se:VrstaUzorka>Krv</se:VrstaUzorka>
        <se:ProizvodjacTesta>BIONTECH MANUFACTURING GMBH</se:ProizvodjacTesta>
        <se:DatumVremeUzorkovanja>2021-11-02T21:32:52</se:DatumVremeUzorkovanja>
        <se:DatumVremeIzdavanjaRezultata>2021-11-02T21:32:52</se:DatumVremeIzdavanjaRezultata>
        <se:Rezultat property = "pred:rezultat" datatype = "xs:string">Negativan</se:Rezultat>
        <se:Laboratorija>Dom Zdravlja Zvezdara</se:Laboratorija>
    </se:Test>  
</se:Sertifikat>